{"blockers":[{"code":"slices-blocked","description":"Slice projection is blocked by seeded provider blockers.","dimension":"slices"}],"contract_name":"skill-document-coverage","corpus_refs":[{"corpus_id":"gaussian-rigorous-calculations-gaussian-g16-c01-public-official-corpus","sha256":"2d05b51310074037d6f8bea0bd6f2bdad5c4c14effde7104c74438edd0f58308"},{"corpus_id":"gaussian-rigorous-calculations-gaussian-g16-c02-delta-official-corpus","sha256":"7f223f48d6e3a5df39788572c0fa99f1e7e1d5008556e8f100256235e3c571aa"}],"coverage_id":"gaussian-rigorous-calculations-official-document-coverage","limitations":["Coverage is metadata-only and bounded to five public Gaussian 16 Rev. C.01 WordPress page records plus the public Rev. C.02 release-note record and platform PDF.","Private manuals, examples, binaries, basis payloads, checkpoints, user data, calculation artifacts, execution authorization, convergence, and scientific acceptance remain outside this pack.","Technical official-document coverage metadata is partial unless all dimensions are complete.","The C.01 keyword, IOp, utility, option, and user-reference leaf graph is not completely enumerated or receipt-bound.","The C.02 materials are a release delta and cannot establish a complete version-matched C.02 reference."],"mappings":{"g16-c01-input-grammar":{"disposition":"partial","limitations":["Slice references are exact and derived from the provider manifest."],"mapping_status":"partial","rationale":"Exact official slices are available for this canonical scope subject.","slice_refs":[{"slice_id":"g16-c01-input-reference-content","slice_manifest_id":"gaussian-rigorous-calculations-gaussian-g16-c01-public-official-slices"}]},"g16-c01-iops":{"disposition":"partial","limitations":["Slice references are exact and derived from the provider manifest."],"mapping_status":"partial","rationale":"Exact official slices are available for this canonical scope subject.","slice_refs":[{"slice_id":"g16-c01-iop-index-content","slice_manifest_id":"gaussian-rigorous-calculations-gaussian-g16-c01-public-official-slices"}]},"g16-c01-keywords":{"disposition":"partial","limitations":["Slice references are exact and derived from the provider manifest."],"mapping_status":"partial","rationale":"Exact official slices are available for this canonical scope subject.","slice_refs":[{"slice_id":"g16-c01-keyword-index-content","slice_manifest_id":"gaussian-rigorous-calculations-gaussian-g16-c01-public-official-slices"}]},"g16-c01-navigation":{"disposition":"partial","limitations":["Slice references are exact and derived from the provider manifest."],"mapping_status":"partial","rationale":"Exact official slices are available for this canonical scope subject.","slice_refs":[{"slice_id":"g16-c01-docs-index-content","slice_manifest_id":"gaussian-rigorous-calculations-gaussian-g16-c01-public-official-slices"}]},"g16-c01-user-reference":{"disposition":"partial","limitations":["Slice references are exact and derived from the provider manifest."],"mapping_status":"partial","rationale":"Exact official slices are available for this canonical scope subject.","slice_refs":[{"slice_id":"g16-c01-users-reference-content","slice_manifest_id":"gaussian-rigorous-calculations-gaussian-g16-c01-public-official-slices"}]},"g16-c02-platform-profile":{"disposition":"partial","limitations":["Slice references are exact and derived from the provider manifest."],"mapping_status":"partial","rationale":"Exact official slices are available for this canonical scope subject.","slice_refs":[{"slice_id":"g16-c02-platform-list-pdf","slice_manifest_id":"gaussian-rigorous-calculations-gaussian-g16-c02-delta-official-slices"}]},"g16-c02-release-delta":{"disposition":"partial","limitations":["Slice references are exact and derived from the provider manifest."],"mapping_status":"partial","rationale":"Exact official slices are available for this canonical scope subject.","slice_refs":[{"slice_id":"g16-c02-release-notes-content","slice_manifest_id":"gaussian-rigorous-calculations-gaussian-g16-c02-delta-official-slices"}]},"gaussian-offline-guard-boundary":{"disposition":"excluded","limitations":[],"mapping_status":"complete","rationale":"This subject is established by local Skill scope and is outside official-provider coverage.","slice_refs":[]}},"producer":{"generated_utc":"2026-07-24T00:00:00Z","skill_id":"gaussian-rigorous-calculations","skill_version":"1.0","tool_id":"official-document-pack-builder","tool_version":"1.0"},"schema_version":"1.1","scope_inventory_ref":{"inventory_id":"gaussian-rigorous-calculations-official-document-scope","sha256":"8415aa88d26b791d1833971c18f0cdb5d8733efedba3cddfd691b3f984c1909a"},"skill_id":"gaussian-rigorous-calculations","slice_manifest_refs":[{"sha256":"faad1987e7a1810a23d79f8d4b646cb43b73fcfbfc3cc2506434fb8d9c03f386","slice_manifest_id":"gaussian-rigorous-calculations-gaussian-g16-c01-public-official-slices"},{"sha256":"cad49446114e78385890f9a8cbfa846454448220b33c359c34b535ecda59cc0d","slice_manifest_id":"gaussian-rigorous-calculations-gaussian-g16-c02-delta-official-slices"}],"status":{"corpus":"partial","mappings":"partial","overall":"blocked","scope":"partial","slices":"blocked"}}
