{"blockers":[{"code":"corpus-blocked","description":"Corpus projection is blocked by seeded provider blockers.","dimension":"corpus"},{"code":"slices-blocked","description":"Slice projection is blocked by seeded provider blockers.","dimension":"slices"},{"code":"scope-blocked","description":"Scope is blocked by seed ceiling or blockers.","dimension":"scope"}],"contract_name":"skill-document-coverage","corpus_refs":[{"corpus_id":"dft-project-orchestrator-repository-contracts-orchestrator-official-corpus","sha256":"d1877abd7174c99a16946b7246da34ff225bfaf215b17ef36e54483e777df8ac"},{"corpus_id":"dft-project-orchestrator-json-schema-2020-12-official-corpus","sha256":"06d39a2208f586df662e80fb20786c255b6f95fa37c253f0a051c52d47047a9c"}],"coverage_id":"dft-project-orchestrator-official-document-coverage","limitations":["JSON Schema provenance is limited to dialect and validation-vocabulary semantics; it does not prove the candidate's hand-written checks are a conforming JSON Schema implementation.","Technical official-document coverage metadata is partial unless all dimensions are complete.","This pack is metadata-only and embeds neither repository contract bodies nor JSON Schema specification bodies."],"mappings":{"jsonschema.draft202012.dialect":{"disposition":"partial","limitations":["Slice references are exact and derived from the provider manifest."],"mapping_status":"partial","rationale":"Exact official slices are available for this canonical scope subject.","slice_refs":[{"slice_id":"json-schema-core-2020-12-whole","slice_manifest_id":"dft-project-orchestrator-json-schema-2020-12-official-slices"}]},"jsonschema.draft202012.validation-vocabulary":{"disposition":"partial","limitations":["Slice references are exact and derived from the provider manifest."],"mapping_status":"partial","rationale":"Exact official slices are available for this canonical scope subject.","slice_refs":[{"slice_id":"json-schema-validation-2020-12-whole","slice_manifest_id":"dft-project-orchestrator-json-schema-2020-12-official-slices"}]},"orchestrator.authorization.human-external":{"disposition":"not-applicable","limitations":[],"mapping_status":"complete","rationale":"This subject is established by local Skill scope and is outside official-provider coverage.","slice_refs":[]},"orchestrator.boundary.inspect-only":{"disposition":"not-applicable","limitations":[],"mapping_status":"complete","rationale":"This subject is established by local Skill scope and is outside official-provider coverage.","slice_refs":[]},"orchestrator.decision.first-match-fail-closed":{"disposition":"not-applicable","limitations":[],"mapping_status":"complete","rationale":"This subject is established by local Skill scope and is outside official-provider coverage.","slice_refs":[]},"orchestrator.identity.strict-exact-bytes":{"disposition":"not-applicable","limitations":[],"mapping_status":"complete","rationale":"This subject is established by local Skill scope and is outside official-provider coverage.","slice_refs":[]},"orchestrator.jsonschema.conformance-excluded":{"disposition":"excluded","limitations":[],"mapping_status":"complete","rationale":"This subject is established by local Skill scope and is outside official-provider coverage.","slice_refs":[]},"orchestrator.lifecycle.development-only":{"disposition":"not-applicable","limitations":[],"mapping_status":"complete","rationale":"This subject is established by local Skill scope and is outside official-provider coverage.","slice_refs":[]},"orchestrator.source.repository-contracts":{"disposition":"not-applicable","limitations":[],"mapping_status":"complete","rationale":"This subject is established by local Skill scope and is outside official-provider coverage.","slice_refs":[]},"orchestrator.state.separate-gates":{"disposition":"not-applicable","limitations":[],"mapping_status":"complete","rationale":"This subject is established by local Skill scope and is outside official-provider coverage.","slice_refs":[]},"repository-interface.catalog-wide-provenance":{"disposition":"partial","limitations":["Slice references are exact and derived from the provider manifest."],"mapping_status":"partial","rationale":"Exact official slices are available for this canonical scope subject.","slice_refs":[{"slice_id":"orchestrator-repository-source-index-whole","slice_manifest_id":"dft-project-orchestrator-repository-contracts-orchestrator-official-slices"}]}},"producer":{"generated_utc":"2026-07-24T00:00:00Z","skill_id":"dft-project-orchestrator","skill_version":"1.0","tool_id":"official-document-pack-builder","tool_version":"1.0"},"schema_version":"1.1","scope_inventory_ref":{"inventory_id":"dft-project-orchestrator-official-document-scope","sha256":"cc5ec03a1ca0f8e6fe8b247ab43b5bab8842ae0f87c85553336fb6b8bd5917d1"},"skill_id":"dft-project-orchestrator","slice_manifest_refs":[{"sha256":"e437856f515dc3f605a17acdb8d6c8f7ab23ea0b766260d8c0a97de454ee768d","slice_manifest_id":"dft-project-orchestrator-repository-contracts-orchestrator-official-slices"},{"sha256":"cc3cb473f69c98f060100ff1938b2988bb3d52a54eedd56b9d7ad5b3b1eff49a","slice_manifest_id":"dft-project-orchestrator-json-schema-2020-12-official-slices"}],"status":{"corpus":"blocked","mappings":"partial","overall":"blocked","scope":"blocked","slices":"blocked"}}
