{"blockers":[{"code":"scope-blocked","description":"Scope is blocked by seed ceiling or blockers.","dimension":"scope"}],"contract_name":"skill-document-coverage","corpus_refs":[{"corpus_id":"dft-review-response-repository-contracts-review-response-official-corpus","sha256":"caab5d5dc547dda6a886c5843fce1bd2667d401e3e61067c94de5b871858da3e"}],"coverage_id":"dft-review-response-official-document-coverage","limitations":["Literature and manuscript evidence authorities are runtime-input-specific and are never replaced by a universal review-response provider.","Technical official-document coverage metadata is partial unless all dimensions are complete.","This pack stores repository-interface identities and semantic scope only; it embeds no reviewer text, manuscript, literature body, scientific result, or response submission."],"mappings":{"repository-interface.catalog-wide-provenance":{"disposition":"partial","limitations":["Slice references are exact and derived from the provider manifest."],"mapping_status":"partial","rationale":"Exact official slices are available for this canonical scope subject.","slice_refs":[{"slice_id":"review-response-repository-source-index-whole","slice_manifest_id":"dft-review-response-repository-contracts-review-response-official-slices"}]},"review.authority.runtime-resolver-external":{"disposition":"not-applicable","limitations":[],"mapping_status":"complete","rationale":"This subject is established by local Skill scope and is outside official-provider coverage.","slice_refs":[]},"review.authority.universal-provider-excluded":{"disposition":"excluded","limitations":[],"mapping_status":"complete","rationale":"This subject is established by local Skill scope and is outside official-provider coverage.","slice_refs":[]},"review.boundary.local-json-only":{"disposition":"not-applicable","limitations":[],"mapping_status":"complete","rationale":"This subject is established by local Skill scope and is outside official-provider coverage.","slice_refs":[]},"review.evidence.claim-map-bound":{"disposition":"not-applicable","limitations":[],"mapping_status":"complete","rationale":"This subject is established by local Skill scope and is outside official-provider coverage.","slice_refs":[]},"review.handoff.human-submit":{"disposition":"not-applicable","limitations":[],"mapping_status":"complete","rationale":"This subject is established by local Skill scope and is outside official-provider coverage.","slice_refs":[]},"review.identity.strict-no-overwrite":{"disposition":"not-applicable","limitations":[],"mapping_status":"complete","rationale":"This subject is established by local Skill scope and is outside official-provider coverage.","slice_refs":[]},"review.lifecycle.development-only":{"disposition":"not-applicable","limitations":[],"mapping_status":"complete","rationale":"This subject is established by local Skill scope and is outside official-provider coverage.","slice_refs":[]},"review.privacy.restricted-content-excluded":{"disposition":"excluded","limitations":[],"mapping_status":"complete","rationale":"This subject is established by local Skill scope and is outside official-provider coverage.","slice_refs":[]},"review.response.no-positive-unsupported":{"disposition":"not-applicable","limitations":[],"mapping_status":"complete","rationale":"This subject is established by local Skill scope and is outside official-provider coverage.","slice_refs":[]},"review.workflow.point-by-point":{"disposition":"not-applicable","limitations":[],"mapping_status":"complete","rationale":"This subject is established by local Skill scope and is outside official-provider coverage.","slice_refs":[]}},"producer":{"generated_utc":"2026-07-24T00:00:00Z","skill_id":"dft-review-response","skill_version":"1.0","tool_id":"official-document-pack-builder","tool_version":"1.0"},"schema_version":"1.1","scope_inventory_ref":{"inventory_id":"dft-review-response-official-document-scope","sha256":"d91c441c2578cd117dc339e377eaf6f7790e8dcac5342dcd48d14262149f27b5"},"skill_id":"dft-review-response","slice_manifest_refs":[{"sha256":"9e30dcaac786c41cd23be5254509774fc06a604d780f2254066d418baca932eb","slice_manifest_id":"dft-review-response-repository-contracts-review-response-official-slices"}],"status":{"corpus":"partial","mappings":"partial","overall":"blocked","scope":"blocked","slices":"partial"}}
