{"blockers":[{"code":"corpus-blocked","description":"Corpus projection is blocked by seeded provider blockers.","dimension":"corpus"},{"code":"slices-blocked","description":"Slice projection is blocked by seeded provider blockers.","dimension":"slices"},{"code":"scope-blocked","description":"Scope is blocked by seed ceiling or blockers.","dimension":"scope"},{"code":"mappings-blocked","description":"At least one canonical scope subject mapping is blocked.","dimension":"mappings"}],"contract_name":"skill-document-coverage","corpus_refs":[{"corpus_id":"deepmd-rigorous-workflows-deepmd-docs-official-corpus","sha256":"1e536581848f5836d7300e05ddd8eb0d270b785ae61f239214cfb909e104e0c1"},{"corpus_id":"deepmd-rigorous-workflows-dpdata-docs-official-corpus","sha256":"4e16e422e6fd3aa33fe3fe5a99d90e4870cd6f79f6b9233dfb02c8315cd93396"},{"corpus_id":"deepmd-rigorous-workflows-dpgen-docs-official-corpus","sha256":"adf193804205d803ebfb70a28050d00c817ed8c8882c4907f6a63657f257fbca"}],"coverage_id":"deepmd-rigorous-workflows-official-document-coverage","limitations":["Exact release documentation and example tree metadata are retained without bodies or executable/serialized artifacts.","Technical official-document coverage metadata is partial unless all dimensions are complete."],"mappings":{"candidate-audit-config":{"disposition":"not-applicable","limitations":[],"mapping_status":"complete","rationale":"This subject is established by local Skill scope and is outside official-provider coverage.","slice_refs":[]},"candidate-audit-layout":{"disposition":"not-applicable","limitations":[],"mapping_status":"complete","rationale":"This subject is established by local Skill scope and is outside official-provider coverage.","slice_refs":[]},"candidate-audit-model":{"disposition":"not-applicable","limitations":[],"mapping_status":"complete","rationale":"This subject is established by local Skill scope and is outside official-provider coverage.","slice_refs":[]},"candidate-audit-run":{"disposition":"not-applicable","limitations":[],"mapping_status":"complete","rationale":"This subject is established by local Skill scope and is outside official-provider coverage.","slice_refs":[]},"candidate-generic-evaluation-handoff":{"disposition":"not-applicable","limitations":[],"mapping_status":"complete","rationale":"This subject is established by local Skill scope and is outside official-provider coverage.","slice_refs":[]},"deepmd.compress.pytorch":{"disposition":"blocked","limitations":["Official-provider mapping is intentionally blocked for this scope subject."],"mapping_status":"blocked","rationale":"The canonical scope marks this official subject as blocked.","slice_refs":[]},"deepmd.data.neighbor-stat":{"disposition":"blocked","limitations":["Official-provider mapping is intentionally blocked for this scope subject."],"mapping_status":"blocked","rationale":"The canonical scope marks this official subject as blocked.","slice_refs":[]},"deepmd.deploy.lammps":{"disposition":"blocked","limitations":["Official-provider mapping is intentionally blocked for this scope subject."],"mapping_status":"blocked","rationale":"The canonical scope marks this official subject as blocked.","slice_refs":[]},"deepmd.freeze.pytorch":{"disposition":"blocked","limitations":["Official-provider mapping is intentionally blocked for this scope subject."],"mapping_status":"blocked","rationale":"The canonical scope marks this official subject as blocked.","slice_refs":[]},"deepmd.infer.python":{"disposition":"blocked","limitations":["Official-provider mapping is intentionally blocked for this scope subject."],"mapping_status":"blocked","rationale":"The canonical scope marks this official subject as blocked.","slice_refs":[]},"deepmd.install.pytorch-cpu-pip":{"disposition":"blocked","limitations":["Official-provider mapping is intentionally blocked for this scope subject."],"mapping_status":"blocked","rationale":"The canonical scope marks this official subject as blocked.","slice_refs":[]},"deepmd.model-deviation":{"disposition":"blocked","limitations":["Official-provider mapping is intentionally blocked for this scope subject."],"mapping_status":"blocked","rationale":"The canonical scope marks this official subject as blocked.","slice_refs":[]},"deepmd.probe.identity":{"disposition":"blocked","limitations":["Official-provider mapping is intentionally blocked for this scope subject."],"mapping_status":"blocked","rationale":"The canonical scope marks this official subject as blocked.","slice_refs":[]},"deepmd.restart.pytorch":{"disposition":"blocked","limitations":["Official-provider mapping is intentionally blocked for this scope subject."],"mapping_status":"blocked","rationale":"The canonical scope marks this official subject as blocked.","slice_refs":[]},"deepmd.schema.training-input":{"disposition":"blocked","limitations":["Official-provider mapping is intentionally blocked for this scope subject."],"mapping_status":"blocked","rationale":"The canonical scope marks this official subject as blocked.","slice_refs":[]},"deepmd.test.all-frames":{"disposition":"blocked","limitations":["Official-provider mapping is intentionally blocked for this scope subject."],"mapping_status":"blocked","rationale":"The canonical scope marks this official subject as blocked.","slice_refs":[]},"deepmd.train.pytorch":{"disposition":"blocked","limitations":["Official-provider mapping is intentionally blocked for this scope subject."],"mapping_status":"blocked","rationale":"The canonical scope marks this official subject as blocked.","slice_refs":[]},"development-no-native-execution":{"disposition":"not-applicable","limitations":[],"mapping_status":"complete","rationale":"This subject is established by local Skill scope and is outside official-provider coverage.","slice_refs":[]},"dpdata.convert.mixed":{"disposition":"blocked","limitations":["Official-provider mapping is intentionally blocked for this scope subject."],"mapping_status":"blocked","rationale":"The canonical scope marks this official subject as blocked.","slice_refs":[]},"dpdata.convert.vasp-outcar":{"disposition":"blocked","limitations":["Official-provider mapping is intentionally blocked for this scope subject."],"mapping_status":"blocked","rationale":"The canonical scope marks this official subject as blocked.","slice_refs":[]},"dpdata.install.pip":{"disposition":"blocked","limitations":["Official-provider mapping is intentionally blocked for this scope subject."],"mapping_status":"blocked","rationale":"The canonical scope marks this official subject as blocked.","slice_refs":[]},"dpdata.plugins.optional-formats":{"disposition":"blocked","limitations":["Official-provider mapping is intentionally blocked for this scope subject."],"mapping_status":"blocked","rationale":"The canonical scope marks this official subject as blocked.","slice_refs":[]},"dpgen.autotest":{"disposition":"blocked","limitations":["Official-provider mapping is intentionally blocked for this scope subject."],"mapping_status":"blocked","rationale":"The canonical scope marks this official subject as blocked.","slice_refs":[]},"dpgen.init.bulk":{"disposition":"blocked","limitations":["Official-provider mapping is intentionally blocked for this scope subject."],"mapping_status":"blocked","rationale":"The canonical scope marks this official subject as blocked.","slice_refs":[]},"dpgen.install.pip":{"disposition":"blocked","limitations":["Official-provider mapping is intentionally blocked for this scope subject."],"mapping_status":"blocked","rationale":"The canonical scope marks this official subject as blocked.","slice_refs":[]},"dpgen.run.concurrent-learning":{"disposition":"blocked","limitations":["Official-provider mapping is intentionally blocked for this scope subject."],"mapping_status":"blocked","rationale":"The canonical scope marks this official subject as blocked.","slice_refs":[]},"dpgen.simplify":{"disposition":"blocked","limitations":["Official-provider mapping is intentionally blocked for this scope subject."],"mapping_status":"blocked","rationale":"The canonical scope marks this official subject as blocked.","slice_refs":[]},"model-data-license-separation":{"disposition":"excluded","limitations":[],"mapping_status":"complete","rationale":"This subject is established by local Skill scope and is outside official-provider coverage.","slice_refs":[]},"split-and-type-map-science":{"disposition":"excluded","limitations":[],"mapping_status":"complete","rationale":"This subject is established by local Skill scope and is outside official-provider coverage.","slice_refs":[]}},"producer":{"generated_utc":"2026-07-24T00:00:00Z","skill_id":"deepmd-rigorous-workflows","skill_version":"1.0","tool_id":"official-document-pack-builder","tool_version":"1.0"},"schema_version":"1.1","scope_inventory_ref":{"inventory_id":"deepmd-rigorous-workflows-official-document-scope","sha256":"8ff0fac39ff6281a8f872ba7d115d42d27978f9acc29def92d6b6d51d98c4aba"},"skill_id":"deepmd-rigorous-workflows","slice_manifest_refs":[{"sha256":"8457f8b989897f23c2e78ad353929543dd07fe7861d50da56d64fcd78645c535","slice_manifest_id":"deepmd-rigorous-workflows-deepmd-docs-official-slices"},{"sha256":"f1e11823633edd853722e9955310f12edb4532d0403d64812655b9c9c24fb565","slice_manifest_id":"deepmd-rigorous-workflows-dpdata-docs-official-slices"},{"sha256":"64c9cbdc8be1fb304a3c4dfb4f4cebe7eb995502d7331caf9df75f0e9e541c86","slice_manifest_id":"deepmd-rigorous-workflows-dpgen-docs-official-slices"}],"status":{"corpus":"blocked","mappings":"blocked","overall":"blocked","scope":"blocked","slices":"blocked"}}
